wo leben sie?Europa und Russland sind auf dem Weg eines friedlichen Aufbaus eines eurasischen Kontinents, der auf der Grundlage des Austausches Hightec gegen Rohstoffe eine friedliche Koexistenz und kooperation gewährleisten wird.Putin hat zu diesem Thema 1 Stunde im dt.Bundestag auf deutsch gesprochen.Dies wurde durch die künstlich herbeigeführte Ukrainekrise unterminiert.Das wird mit Trump korrigiert werden.Niemand hat behauptet, dass China Norkorea braucht. (Lesen)Sondern dass sie Nordkorea kontrollieren. Ohne die Unterstützung Chinas ist die kommunistische Diktatur dort am Ende.;0
Wir als Integrationsunwillige Gesellschaft sind natürlich der Hemmschuh ! Meine Güte für solch eine BEAMTEN-und JOURNALIENBANDE bezahlt man auch noch immer schön weiter! Ich gebe euch mal einen Tip ! Noch nichtmal die TÜRKEN sind INTEGRIERT WEIL SIE ES NICHT WOLLEN !KAPIERT??;0
"Die Laien-Ministerin kann zwar nicht mehr ""werfen"" aber sie erzeugt bei |LBR| mir Geilheit: ""den Umschalter zu nutzen.""";0
Wenn wir ihm würdige Bedingungen bieten, müssten wir sie der ganzen Welt bieten. Wie bitteschön soll das funktionieren?;1
Ein Witz. Jetzt wird Seehofer für die Schlappe von cdu/csu verantwortlich gemacht. |LBR| Nur die #Merkel ist Schuld an Überflutung &ampi AfD Erfolg;0
für die ist das vorenthalten von gratisspielen, gratisfilmen und gratismusik auf gleicher ebene wie mord.;0
Einsammeln und ab nach PalästinaDemonstrierverbot für Ausländer.Was diese Moslems machen ist Landfriedensbruch.Ein Grund sie schnellstens abzuschieben!;0
Alles aufgelistet...sogar minutiös und trotzdem keine feste Handhabe gegen diese geile Kreatur..? |LBR| So hat Amri auch angefangen das Drecksstück aus Freiburg auch....usw. usw......;0
genau, Steinewerfen ist dort gute alte Tradition, das wird nur missverstanden!;1
Ob die Verluste durch den ausbleibenden Tourismus von den Einnahmen der Migranten/Flüchtlinge gedeckt werden, wage ich zu bezweifeln. Aber die Zeit wird es zeigen, sollte Piräus bis zur Hauptsaison geräumt sein und Idomeni nicht, trifft ihre Vermutung wohl zu.;1
Merkel verspricht wieder das schnelle Internet ab 2018 &gti denkt diese Tusse wir Mecklenburger sind verblödet oder alle in der CDU ??????;0
"Eine Frage ""War um ist Altmaiers IQ nie dem über den 40-Gad von Merkel vorbeigekommen? Das ist Tatsachen-Frage!";0
"erhöhter Grunderwerbssteuer:sehr fördernd für Startups !Die OECD (die übrigens verschämt zugesteht, dass Ö bei den Einkommen sehr gleich ist), wird von einem ehemaligen hohen Beamten der mexikanischen sozialistischen Staatspartei geleitet.Nuff said.Vermögenssubstanzsteuern, die Sie offenbar wollen, müssten bis hinunter zu Wohnungsbesitzern gehen, um genügend Ertrag zu bringen (der dann für die Doppelpensionen im öff.Bereich verwendet würde). Und , bitte, was sind """"konservative Vermögen"""" ? Vermögen konservativer Menschen und damit eigentlich zu enteignen ?Erbschaftssteuern ? ich will meinen Kindern was hinterlassen, statt das es für die Luxuspensionen im öff.Bereich und für sinnlose Förderungen  von Spezis verschwendet wird";1
hingis - hab seit paris´99 (vs. graf) eine große schwäche für sie.ich hoffe sie bleibt auch so lange wie die frau navratil im business.btw schaut sie jetzt auch viel besser aus,- kein egostress, keine helikopter mama, keine drogen, richtig gsund :);1
Ich will erst einmal wissen, was Frau Merkel anders machen hätte sollen, wenn es ja angeblich so schlecht war, was sie gemacht hat...;1
Wird also in frühestens 2 Jahren abgeschoben, da Wirtschaftsflüchtling oder?;1
Von wegen übertriebener Polizeigewalt. Die Polizei muss in Zukunft |LBR| viel härter vorgehen. Aus Maul hauen und dann verhaften.;0
Ich denke nicht dass man das aus dem Schaukelstuhl im immer noch friedlichen österreichischen Kuschel-Umfeld beurteilen kann.Der Unterschied zu den umliegenden Staaten: Es wird ein rechtliches Verfahren eingeleitet - und das obwohl er ein Soldat ist bzw. kurz vorher ein Angriff erfolgte', das erwarte ich mir von einem demokratischen Rechtsstaat.;1
Viel mehr scheint es so, also ob Annette Humpe und Adel Tawil mal zwischendurch ein Kindergedicht geschrieben hätten und das ganze mit Musik untermal hätten.;0
ich möcht gerne einmal wissen, was der rotstrichler eigentlich denkt, oder besser was ihm dazu bringt, dieses posting so zu bewerten?;1
Beim 1:0 einfach ein Musterbeispiel unglaublich schnellen Umschaltspiels. Extrem schnell im Kopf von Drinkwater. Innerhalb weniger Sekunden das ganze Feld bis zum schlussendlich erfolgreichen Abschluss überbrückt.;1
auf den griechischen Inselnscheinen Ihnen und Ihren Befürwortern entgangen zu sein.;1
Diese Autos wird man auch nicht kaufen, sondern eher mieten.;1
Wie der illegale Besatzer damit umgehen soll?;1
Reizende Leutchen scheinen das zu sein;1
WIrd eh nur LEuten mit guter Bonität angeboten.;1
zur strafe nach stein ?paaassst!saubere bürschchen haben wir da ins land gelassen;1
Ihr letzter Satz verrät, dass Sie von der Sache wirklich wenig Ahnung haben. Das Mittelalter kennen Sie auch nicht.;0
Ich mag ihre Musik aber nicht so, die alten Schlager der 70-er Jahre waren besser.;0
Wenn schon, dann wäre eher LinkedIn oder XING zu empfehlen...;1
"Idomeni: Polizei muss sich erneut mit Tränengas und Blendgranaten gegen unrechtmässig eingesetzte Gewalt von Wirtschaftsflüchtlingen wehren. NGO´s neuerlich anstiftende Kraft im Hintergrund.Vorschlag für eine """"Schlagzeile"""" mit ein wenig mehr Wirklichkeitsbezug...  (C',";1
Ich glaube das alles nicht die STAATSMEDIEN finden doch immer wieder einen selbst unter den Angehörigen wie diesen Herrn CIMZECIZ oder so die dann die SED-Vorsitzende GUTREDEN!Das muß man sich mal überlegen!Sein Kind malt der Mörderin seine OPFERs Bilder!GOTT ICH MUß KOTZEN;0
fuer nutztiere sind diese zahlen recht gut bekannt, u.a. weil man ja auch versucht die methangasproduktion durch die tiere zu minimieren. fuers in vitro fleisch ist es nicht bekannt, deswegen laesst sich das ganze recht einfach als gruene-alternative darstellen...http://www.fachinfo-schwein.de/Aktuelles/News/2011/Juni/Oekobilanz_von_Schweinefleisch_verbessert.aspx#;1
Doch. Öffentlich. Muss die Quelle suchen....;1
"Allerdings nicht nur im Netz, auch in großen österreichischen Tageszeitungen wurden falsche Behauptungen über Flüchtlinge verbreitet.""""Irgendwie süß. Gerade der Standard, euphorisiert von der Willkommenshysterie, hat da gleichsam an vorderster Front mitgewirkt (da gabs auf einmal nur mehr Asylwerber aus Syrien, fast alle hatten mindestens einen Uni-Abschluss, der Arbeitsmarkt konnte nicht überleben ohne, der IS würde NIE jemanden über den Balkan einschleusen, etc etc). Gut, ist nur vom Format her eine der """"großen"""" Tageszeitungen, aber dennoch, Lügen gibts und gabs von beiden Seiten. Bitte aber nicht im Glashaus sitzen und mit Steinen werfen.";0
Israel wird noch weiter bauen!!Israel wird so viel bauen, bis das ganze Volk Israel im Staat sein wird!Die Situation von Israel können wir Menschen NICHT abschätzen. Die säkulare Raffinesse vom kritischen Herumschreien wird NIEMALS fassen!!Wer die Bibel nur etwas kennt, weiss genau, dass hinter der Neugründung vom Staat Israel prophetische Erfüllungen stehen!! Die Rückkehr vom Volk Israel ist noch lange nicht abgeschlossen.Sacharja 10:10  Denn ich will sie wiederbringen aus Ägyptenland und will sie sammeln aus Assyrien und will sie ins Land Gilead und Libanon bringen, daß man nicht Raum für sie finden wird.Doch wehe denen, die dieses Vorhaben stoppen wollen. Die werden sich daran wundreissen.;1
Wieso lässt man die sticker der sj nicht?  Gleich super gespart liebe fpö.;1
Ich bin 13 Prozent und toleriere es wenn 87 Prozent in den VOLKSTOD gehen den sie so populistisch propagieren ??????????????????;0
Wenn sie nicht so blind vor Hass wären, dann würden sie es schon sehen.;1
Jetzt hört doch auf mit dem 2-maligen Sitzenbleiber Schulz. Der ist doch ein |LBR| unwürdiger Kanzlerkandidat. Jagt ihn davon.;0
der gerade einen Kameraden ermorden wollte und es ja immerhin auch fast geschafft hätte.;1
der idf gehandelt. dafür wird er vor gericht stehen und verurteilt werden;1
Das zeigt doch wieder einmal welche Vollspacken uns regieren! Hauptsächlich Hohlköpfe. ??????????;0
"Nur am drücken auf ""Wir waren ja so schlimm"" .. Die sollten mal daran denken das Islamisten heute noch schlimm sind! Lügenmedien halt !";0
Primär geht es nicht um Flüchtlinge sondern wohl um Grenzverletzer, sollte schon klar beschrieben werden.;1
Die Balladen machen zwar keinen Schaden, klingen aber so, als ob man sie schon zig-tausend Mal in leicht abgeänderten Varianten gehört hätte.;0
no nation - no law -> law of the strongest and survival of the fittest...ob die no border/no nation-befürworter ihr konzept wirklich zu ende gedacht haben?;1
Super!;1
Griechenland-Albanien-Italien 50% mehr als Vergleichsdaten 2015Türkei/Griechenland - Bulgarien - Serbien/Rumänien - Ungarnhttp://goo.gl/vlSqJt;1
Nein, das haben Sie wieder mal nicht verstanden.;1
...SCNR;0
das ist das problem. es wird nur mehr verwaltet, es gibt keine visionen, niemand riskiert etwas. und alles läuft irgendwie schief und unrund. aber noch geht's allen gut bei kaffee und kuchen.;1
So so, wir haben also zahlreiche gut dokumentierte Fälle von Menschenrechtsverletzungen von verschiedenen Menschenrechtsorganisationen, aber weil der Sprecher des israelischen Außenministeriums sagt, die Vorwürfe wären falsch, müssen sie auch falsch sein. Sind also die Vorwürfe von Menschenrechtsverletzungen in allen anderen Ländern ebenfalls falsch, nur weil das die jeweiligen Regierungen dort behaupten? Wie viele Regierungen kennst du, die offen zugeben, Menschenrechtsverletzungen zu begehen?;1
Hetze der öffentlich- rechtlichen gegen Trump zum kotzen diese verlogenen Vasallen Merkels!!!;0
Ernste Frage oder rhetorisch? Selbstverständlich möchte Griechenland, dass die Balkanroute wieder auf geht - das wäre wie Weihnachten und Ostern zusammen. Dann könnte man mehrere zehntausend Menschen einfach wieder durch winken, und das Problem wäre aus Sicht Griechenlands gelöst. Deshalb gibt es auch keinerlei Konsequenzen, wenn hier Aktivisten aufstacheln und zum Stürmen der Grenze aufrufen (Flugblätter, Lautsprecher-Durchsagen, etc.). Ist ja im Interesse Griechenlands, wenn die Grenze fällt.;1
Ohne Bohlen-Auftrieb würde die heute auf gewissen Straßen tippeln?! ??;0
Na...;1
Merkel diese Volksverräterin muss weg!!!!;0
Nein, ich sehe da kein Asylgrund. Und das Anliegen sofern es denn auch wirklich fair und gründlich untersucht wird kann nur abgelehnt werden. Richtig, Österreich kann und muss nicht Alle aufnehmen.So hart das klingt, aber wir sollten uns wirklich um die Flüchtlinge kümmern, die aus Kriegsgebieten zu uns kommen und nicht um jene, welche die aus wirtschaftlichen Überlegungen in die EU wollen.Natürlich ist es kein Verbrechen ein besseres Leben zu wollen.Aber sie können mir gerne erklären, wie sie sich das vorstellen, wenn wir die ganzen Wirtschaftsmigranten auch noch aufnehmen.Oder wollen sie hier in diesem Fall einfach einen Ausnahme machen?Und wo hört es dann auf mit den Ausnahmen?;1
Wie kann nur jemand so dumm sein....was für eine dumme Kuh...;0
"Ah ja. Und Sie können sicher auch den Beweis liefern, dass das kein Fake ist, nicht wahr? Immerhin werden die """"Parolen"""" auf Arabisch heruntergebetet. Kann also genausogut ein Propagandafake sein. Der Ton könnte sogar aus dem Off sein. Es ist sogar ziemlich unwahrscheinlich, dass ein Israeli sagen würde: """"We are the occupation army"""". Das klingt eindeutig nach palästinensischer Diktion...";1
Um das auch zu machen was Österreich macht dafür müßen wir uns erst einmal von völlig durchgeknallten LinkenGrünen und Schwarzen befreien! Kein Land mit WERTEN kann sich solche Idioten die schon kriminell handeln erlauben !;0
Wo ist der LKW wenn Merkel mal auf dem Weihnachtsmarkt ist.;0
Politiker gleichbedeutend mit BERUFSLÜGNER richten gerade irreparable Schäden für unser Land Europa und die Welt an und Mio schauen zu ??;0
da produzieren die Schulen 40 Prozenzt Analphabetenb, die nie einen Job bekommenw erden und uns noch viel Sorgen ebreiten werden, und diese Frau spricht von einem funktionierenden Bilkdungswesen.Was würde das aübertragen auf das Gesunheitswesen bedeuten? Vier von Zehn überleben den Arzt nicht?;0
offenbar glaubt der junge mann, in östereich hat jeder ein eigenes haus... sehr naiv. schade dass er die zeit nicht zum deutsch lernen nützt. und sich korrekterweise um eine RWR-Card bewirbt anstatt kriegsflüchtlingen den platz im asylwerberquartier wegzunehmen.;1
"wenn in der EU nur 1 land asylanträge mit immigration gleichsetzt... dann ist das mit """"Europäisches Asylwesen und Verteilung"""" eine kurze diskussion, die sofort mit einem 90%igen nein endet...jemand der das bis jetzt noch nicht begriffen hat, der hat sich nichtmal 5 minuten gedanken dazu gemacht, sry, weltfremd";1
"ja, was sollen wir denn tun? echt jetzt!nocheinmal hunderttausend aufnehmen?Geht das?Nein, es geht nicht!Mir ist die Sicherheit in meinem Land halt was wert, sorry...dafür würd ich auch demonstrieren gehen - ich will weiter meine Kipferln kaufen, beim """"Mann"""" und in Ruhe meinen Veltliner trinken..ist das """"kleinkariert""""? mag sein.Ich bin halt so.Darum möchte ich keine weiteren Asylwerber - denn das würde zu echten Unruhen führen, es gäbe Volksaufstände, Straßenschlachten usw.das will ich nicht!Und wenn ihr alle lieb seid und wenn alles friedlich bleibt, wähle ich auch weiter schön brav die SPÖ.Wenn es ungut wird, muss ich den Strache wählen...willst das? nein?also...Friede! :)";1
Ueberlegen sie mal woher kommen verschwoerungstbeorien? Meist wenn die breite masse ueber etwas im unklaren gelassen wird.;1
Immer dieses ideologischen Argumente. Echt mühsam.;0
Wir geben unsere Identität nicht auf sondern sind bereit dafür zu kämpfen. Die Burka gehört nicht zu Deutschland. #Burkaverbot;0
dann gute Nacht 2043.wenn diese socialmedia Kampagnen immer so gut funktionieren - dann gute Nacht, wenn das mal ein vifes Kerlchen einsetzt.;0
bedauerlich;1
In 2 Jahren spricht er deutsch, ist integriert und nach einem Tipp eines NGO Mitarbeiters in irgendeinem Sportverein.;1
Lauter trojanische Pferdchen....machen wir es wie unsere Nachbarländer: |LBR| Ausübung und Ausbreitung des Islam o Islamismus untersagen..!;0
Diesind das eigentlich für Schmierfratzen die für diese Texte und eigentliche Fake-News ...verantwortlich sind?;0
Es ist zum Kotzen seit Tagen!;0
... dann werden sie sich gleich besser fühlen. Versprochen.;0
War bestimmt nur eine Türkische Hochzeit. Da ist das normal. Da wird gerne mal aus dem Auto geschossen. :-);0
seine Grenzen gegen unbefugtes Betreten von aussen zu schützen.Das schliesst auch (angemessene) Gewaltanwendung nicht aus.;1
Und wieso wurde dieses etwas nicht Zwangsverheiratet...?;0
Srsly. WTF?!Israle = Wolf im...;1
...Und zwischen 6000 und 600 gibt es einen Spielraum;1
Eben keine 10Jahre Arbeitsleistung.Dein ganzes Posting war Schwachsinn.In jedem Fall ist sie berechtigt in Ruhestand gegangen.;0
Ich halte Menschen wie Sie die sich über BKA-Gutachten hinwegsetzen für primitiv. Sie bekommen das Gutachten damit nicht weg.;0
Auch in der tiefsten politischen Senke!;0
Die Afrikaner können wir in Europa nicht brauchen. Sie müssen zurück |LBR| und in ihrer Heimat endlich anpacken. Unsere Sozialsysteme schließen.;0
Hitler ist zurück und heißt jetzt Merkel!!;0
Die Ultras sind das gleiche Pack wie linke Anarchistenwann wird endlich mal durchgegriffen.Unsere Juristen sind halt alle Gutmenschen die lieber eine arme Rentnerin ins Gefängnis schicken;0
Stimmt schon, ist aber für den ersten Wahlgang noch relativ unerheblich. Umso mehr für Van der Bellen, weil - zumindest laut Umfrage - unter seinen Sympathisanten noch relativ viele Leute sind, die sich mehrere Optionen frei lassen und also keine Fixstimmen sind.Hofer z.B. hat dieses Problem weniger, weil es so viel mehr FPÖ-Stimmen gibt als grüne und auch, weil erstere großteils isoliert genug sind, dass sie sowieso und trotz Lugner und Griss für ihn Stimmen. Was der allerdings tun muss, ist seine Leute auch wirklich zum Wählen zu bewegen. Auch nicht leicht.;1
Die Grenzen sind weit offen alle kommen sie herein registriert oder nicht das interessiert hier kein Schwein ....Das gibt es nur in Deutschland;0
Ich glaube, dass mit AC/DC bald Schluss sein wird. Jetzt fehlen schon drei wichtige Mitglieder aus den 70ern: Scott, Rudd und auch Malcolm Young. Und wirklich fit sind sie auch nicht mehr, bereits jetzt auf der Rock or Bust Tour ist schon alles einstudiert, jede Bewegung, und sind die Pausen zwischen den Songs schon recht lange. Es ist halt ein Unterschied ob jemand mit 23 oder mit 60 auf der Bühne steht. Manche haben sich vom über 90 jährigen Chuck Berry ja noch einen Duckwalk wie vor 50 Jahren erwartet, obwohl er nicht mal mehr seine eigenen Songs ordentlich spielen konnte. Man sollte m.E. auch einmal eine schöne Sache gut sein lassen statt sie künstlich in die Länge zu ziehen.;1
Das einzige das an alte Zeiten erinnert ist das gejammer. Ein paar Minuten in youtube helfen signifikante Verbesserungen in Taktik, Spiel mit dem und gegen den Ball zu erkennen... vorausgesetzt man hat die letzten Spiele des ÖFB Teams überhaupt gesehen ',);1
Der Täter mißbraucht das Asylrecht, dass seine körperliche Integrität schützt, weil er als verfolgt anerkannt ist.Als Dank dafür verletzt er in höchstem Masse die körperliche Integrität einer jungen Frau.Es ist äußerst unwahrscheinlich dass es bei diesem jungen Mann zu einem Sinneswandel, zu einer Läuterung kommt. das eigentliche Problem ist dass dieser Kerl wieder freigelassen wird denn lebenslang hinter Gitter wird nicht funktionieren. Konstruktiver Beitrag?;1
Wenn die Briten ernten was sie säen müssen sie ihr Saatgut an den |LBR| Grenzen genau überprüfen. Keine Giftpflanzen aus dem Nahen Osten.;0
"...wäre das nicht ehrlich, und auch wieder Wasser auf die Mühlen von KCStreichel """"Die verschweigen die Warheit, welche ihr nur von mir erfahrt..."""" und ähnliches....Von dem her finde ich es auch gut dass das Schicksal von sogenannten """"Wirtschaftsflüchtlingen"""" beleuchtet und zumindest menschlich verständlich gemacht wird....aber man sollte halt klarstellen dass im Moment diese Flüchtlinge NICHT die Mehrheit stellen!";1
... nein! Es wird auch keine Straße nach ihm benannt werden ...;1
...welche Autonomie?zur Erinnerung Tricky Bibi: I stopped the Oslo Accordshttps://www.google.at/search?as_q=Netanyahu+stopped+Oslo+&as_epq=&as_oq=&as_eq=&as_nlo=&as_nhi=&lr=&cr=&as_qdr=all&as_sitesearch=&as_occt=&safe=images&as_filetype=&as_rights=nicht+nach+Lizenz+gefiltertsoviel zur Gültigkeit des Oslo-Abkommens;1
|LBR| Tiraden gibt es nur von Deutschland / EU gegen Trump und nicht umgekehrt |LBR| #manipulationspresse;0
Frau Alaba ist einer jener sehr gefragten philippinischen Krankenschwestern, die schon seit zig Jahren den Betrieb in den Spitälern aufrechterhalten. Ich glaube nicht, dass diese KS sehr diskriminiert wurden. Bei den vielen Aufenthalten meines Vaters in div. Spitälern konnte ich diesbezüglich nichts feststellen.Und einen Musikstudenten (Papa Alaba) feindet man bei uns auch eher weniger an.;1
Wie verkommen müssen erst die sein die dieses Gesicht gewählt haben....;0
"Die fahren ja sogar durchs ärgste Gedränge am Donauinselfest oder jetzt aktuell am Rathausplatz durch die Filmfestival-Standeln (obwohl da groß und deutlich an den Eingängen steht """"Fußgängerzone - Radfahren nicht erlaubt"""")";0
"Nein, da wird stattdessen fieberhaft an einem """"Ja aber ..."""" gefeilt.";1
WEGWEGWEG mit LINKS !!! Kein Klagerecht für Migranten ! Keine Unterstützung mit SchwesigRaubgeld für Linksautonome ! Prob gelöst!!!;0
sofort abk.......n! |LBR| Oder Spanien gibt das von Marokko beanspruchte Land zurück und Ruhe ist!;0
.Ich warte auf dem Moment das diese dummdeutschen das begreifen und diese Volksverräterin zur Verantwortung zieht!!!;0
http://derstandard.at/2000036040090/Details-zu-Praterstern-Vergewaltigung-Opfer-gezielt-abgepasst  http://diepresse.com/home/panorama/wien/4973083/Praterstern_Studentin-von-drei-Jugendlichen-vergewaltigthttp://diepresse.com/home/panorama/oesterreich/4973294/Sexualdelikte_Ueberhang-bei-afghanischen-Taetern?from=simarchiv Für unbegleitete minderjährige Migranten werden 97 Euro pro Tag an Betreuungseinrichtungen bezahlt. Wurden auch diese Täter so betreut, dass sie um Mitternacht am Praterstern unterwegs sind? Wer hat diese Jugendlichen betreut und wieviel Geld wurde für diese Betreuung bezahlt? Wie schaut die teure Betreuung in der Praxis aus? Darüber wird nicht berichtet.;1
aufgrund dieses eugh urteilshttp://www.spiegel.de/wirtschaft/soziales/hartz-iv-eugh-urteil-zu-frau-aus-rumaenien-in-deutschland-a-1002187.htmlkönnte man sogar noch viel weiter gehen und auch eu-ausländern div. sozialleistungen der gemeinde kürzen. Tut man aber nicht. so gesehen ist wels eh immer noch seeeehr sozial.;1
die pochen auf ihr Recht, des illegalen Grenzübertritts samt illegalem Aufenthalt in der EUWo kommen wir denn dahin, wenn alles illegale einfach verboten wird ?;1
Da gibt es ja Alternativen: Mühle oder Menschärgeredichnicht!;1
Stimmt echt ungebildet und kreativlos die ungewaschenen Seifehasser!;0
... sorry, lieber 100 mal den Blues einer zu Lebzeiten schon beinah untoten Amy Winehouse als diesen drei mal weichgespülten Bio-Soul! NEXT!;0
http://s1.stc.m.kpcdn.net/share/i/12/9280802/big.jpg;1
Naja, durchgeknallte Spinner gibt's überall ...;1
Ich glaube immer mehr dass wir die Hirne unserer Politiker nur auf Erbsengröße kriegen wenn diese aufgeblasen werden ??;0
Da hat Marshal Hirscher einmal mehr gezeigt, wer Gesetz im alpinen Skisport ist.;1
mittlerweile erkenn' ich einen brickner schon an der HL ',);1
Und Merkels Muschpoke leistete Beihilfe zum Mord &gti das sind ihre Werte ??;0
...sie wird diese 4jahre noch absitzen und den befällt sie der Alzheimer.... |LBR| Und wenn doch nicht dann auch egal...wir sind trotzdem am Arsch;0
"Merkel – Vollbeschäftigung bis 2025 ""das ist zu schaffen"" ?????? Das Lügen u. Betrügen geht auch zur BTW 2017 weiter ??????";0
Also...ich mag Stegner oder das etwas Schulz...die dicke Nahles und der kleine unterernährte Heiko gefällt mir auch gut... |LBR| Nur mit diesen in den Reihen schaffen wir die ersehnte unter15% Hürde.....??????????????;0
"Wahnsinn, ein """"einfcaher"""" Bürgermeister hat kein Problem damit dem Hr. LH die Stirn zu bieten und klare Worte zu finden und unser BK Fay(g)mann versteckt sich hinter Platitüden bzw. im Urlaub.Chapeau Hr. Bürgermeister Posch!";1
Russland ist in wk1 vorzeirig ausgestiegen. ',-)Wk2 der dabk gilt den lieferungen der westlichen allierten.Sind die mongolen nicht druebergefahren und haben sich dann spaeter praktisch selbst aufgeloest;1
Ich darf nicht bewerten weil die Standardredaktion mich mutwillig gesperrt hat in ihrer Zensur.;1
Leichte Delikte wollen Sie den Asylwerbern zugestehen? Das fängt ja gut an, wenn die gleich einmal kriminell werden!;0
Trotzdem kann mans ändern jeder ist selbst der Widerstand;0
Griechische Behörden beschuldigen Aktivisten, die Flüchtlinge im Lager Idomeni anzustacheln. Immer wieder gibt es dort Tumulte. Wer ist wirklich verantwortlich? Eine Spurensuche vor Ort.http://www.spiegel.de/politik/ausland/fluechtlinge-in-idomeni-aktivisten-sollen-unruhen-anzetteln-a-1086805.html;1
das wäre ein armseliger staat, der die strafrechtspflege nicht mehr selbst besorgen kann. so weit ist es noch nicht.;1
Hatte Yücel am Ende doch recht..?...ich bleibe bei meiner Aussage: 80% der deutsche sind verblödete Schwachsinnige.. |LBR| Ihnen ist ????egal...!!;0
das soll jetzt KEINE beleidigung sein, aber ich finde ohne seine sonnenbrille sieht er aus, als hätte jede denkbare droge genommen;0
Würde sich Israel an die Genfer Konventionen halten, dann hätte dieser Vorfall gar nicht stattfinden können da das Mädchen am Eingang einer Siedlung gefasst wurde welche laut Genfer Konventionen illegal errichtet worden ist.;1
Was würdest Du tun,  würde Dich so ein Kind mit Steinen bewerfen? Zu ckerwatte ihm anbieten? Dazu mild lächeln?;1
Er ist schon so Klug und lässt sich im Dienstwagen von seinem Chauffeur zum Verwandtschafts Besuch fahren.;0
Perfektes Fußballerdeutsch lernst locker in 3 Monaten :);1
Ich kenne auch Einige und für diese Menschen sind Sie ein Mittel zum Zweck.;1
in Afghanistan!;1
was soll uns vorgegauckelt werden, heile flüchtlingswelt? eine spendennummer gleich dazu........facebook hinweis!;1
"DDR ""Überwachungsstaat""??? Merkel u. ihre Bande führen den totalen ÜBERWACHUNGSKRIEG erfinden Vorwände u. lügen dass sich d. Balken biegen??";0
Der Islam kann nichts anderes als hassen. Die ganze Ideologie ist auf Hass Unterdrückung Mord und Totschlag ausgerichtet.;0
Türkeiurlaub gestrichen. Keinerlei Vergünstigungen für Türkei. Bis sich dort die |LBR| Demokraten gegen den irren Sultan wehren und ihn davonjagen;0
"So schlimm ist es in Israel jetzt wirklich nicht. Und so schlimm wie in Syrien schon gar nicht. Ich bin jedes Jahr in Israel und ich fühle mich dort wesentlich sicherer als in Europa. Im Gegensatz zu Europa hat Israel den islamistischen Terror ziemlich gut im Griff. Die Messerangriffe sind ein Sonderfall, weil sie nicht organisiert und daher schwer im Vorfeld zu verhindern sind. Ich wage gar nicht daran zu denken, was bei uns los sein wird, wenn jihadistische Irre in Europa """"auf den Geschmack kommen"""". In Europa gibt es wesentlich potentielle islamistische Messerstecher als in Israel. Und was Sicherheitsstandards angeht, hinken wir einige Jahrzehnte hinter Israel her...";1
dazu ist ein Staat auch berechtigt, wenn Gesetze nicht eingehalten werden.;1
klar, verglichen mit russischen herbergen...;1
antisemiten im Forum lesen.;1
