wieso kaltblütiger mord ? er stand unter stress keine frage, bedingt durch den angriff...da kann so eine verspätete Reaktion schon passieren...außerdem gilt die unschuldsvermutung, schon vergessen ? in Österreich erschlagen Männer kleine kinder oder ihre Frauen wenn das essen nicht warm genug ist oder schon wieder kalt...also macht euch nicht ins Hemd, geht lieber zur nächsten Wahl statt euch davor zu drücken...;1
Teilweise sind die Titel dermaßen mit technischen Soundspielereien überladen, dass sie nur noch anstrengend wirken und stimmlich bringt Cassandra auch nicht so viel Gefühl rüber wie ich mir erhofft hatte.;0
NICHT: ...die mazedonische Polizei am Mittwoch erneut mit Tränengas und Blendgranaten gegen Flüchtlinge vorgegangen...SONDERN:...die flüchtlinge wollte unbefugt und mit gewalt in mazedonisches staatsgebiet eindringen...;1
Der Papst würde auch den Arsch des Teufels küssen wenn es ihm nützt;0
Hofer verhindert gehört, anstatt ihn z'fleiß zu wählen um einer anderen, von dir abgelehnetn Partei, eins auszuwischen.Kannst du das wirklich reinen Gewissens unterstützen einem Menschen deinem Stimme zu geben, der öffentlich mit extremen Rechten und Nazis kokettiert - und das tut er mit der Kornblumenaktion eindeutig -  und Kritik daran auch noch auf lächerliche Weise versucht wegzuwischen? Allein das schon ist ein Ausschlussgrund von hunderten. Ich halte dich für einen intelligenten Menschen, aber in der Politik verrennst dich vollkommen. Ich würds mir wirklich noch einmal gut überlegen.;1
Ich würde ihnen einen kleinen Abstecher zur Haager Landkriegsordnung empfehlen. Dort steht drinnen, was Israel darf oder nicht.Könnten sie mir bitte den Passus in der Genfer Konvention zeigen?;1
dumme göre, hoffentlich machst du morgen den letzten platz.;0
Gerettete Flüchtlinge? Nein vor der lybischen Küste abgeholte |LBR| Invasoren fluten die italienischen Häfen. Schluss damit.;0
Die setzt statt auf Aus Bildung und Berufserfahrung auf Qoutenweiber. |LBR| #Sozenversenken;0
Interessant, danke.Obwohl die Info vom Vorposter auch recht schlüssig klingt.Denn laut wiki zumindest sprechen auch sie einen persischen Dialekt, wenn auch mit mehr mongolischen und türkischen Lehnwörtern - nur sehen sie anders aus. Wird schon auch der alte R. reinspielen. Denn die Iraner sehen sich ja als ehschowissen... das kann man hier nicht schreiben, fängt mit A an..;1
in afghanistan oder im iran versumpern kann der junge herr noch sein restliches leben, durch die flucht hat ers zumindest versucht sein schicksal zu ändern. naivität würde ich es daher nicht nennen. auswegslos sind wohl beide situationen: sowohl die perspektive in aut als auch im iran scheinen dem jungen keine gesicherte zukunft zu bieten, warum also nicht alle optionen ausschöpfen? finde ich nicht naiv sondern nachvollziehbar, immerhin hat er nichts zu verlieren. dass er aufgrund mangelnder bildung nicht übers asyl und flüchtlingsrecht sowie anerkennungsgründe bescheid weiß ist wohl auch kein großes wunder.;1
Ne10 jährige wie dich blockiere ich einfach ! Ob du mich Rassist nennst oder in China ne Möse feucht wird interessiert doch wirklich keinen;0
stimmt doch nicht:http://www.bmvit.gv.at/verkehr/luftfahrt/sicherheit/downloads/_konsolidierte_Fassung_2010_185_VO_idF_104-_03_2013_DE.pdfSeite 20, Anlage 4c;1
Gabriel hat sich gemeldet weil er auch mal was sagen wollte!! Diese Witzfigur nimmt doch keiner erst weltweit nicht!!;0
Kinder zum Hass zu erziehen ist eine der schlimmsten Formen von Kindesmissbrauch. Und als mindestens so schwerwiegend bezeichnen wie körperlicher Missbrauch. Denn beides zeitigt langfristige Folgen.;1
"Viell. werden eines Tages die Akten all der Kohls Merkels u. Gaucks geöffnet u. der gesamte Lug u. Trug um eine ""Einheit"" kommt ans Licht ??";0
Das sagt mehr über die Kinder als über den Hamster aus. ^^;1
Naja, wenn der EU-Migrationskommissar ausgerechnet Grieche ist...Bock --> Gärtner;1
Ich sehe mir keine Sendung mehr an wo der Internet schnüffler Maas mit am Tisch sitzt.;0
Na, die Salzburger kommen ja heute. Die sind aber auch alles andere als ein Jausengegner...;1
Araber haben schon ekelhafte Fressen....!;0
Das Grauen hat ein Gesicht...;0
Die ganze „Mafia“ in Berlin muss weg das Volk kann es auch selbst dazu brauchen wir keine Politmarionetten.;0
Ich bin der Ansicht, dass man nur Tiere essen soll, die man selber getötet hat.Ganz vollständig kann ich selbst das Prinzip nicht durchziehen, vor allem weil ich viel unterwegs bin, aber ich gebe mir Mühe.Ich bin sicher, dass der Fleischkonsum stark zurückginge, wenn die Menschen mit der Realität der Tötung eines Lebewesens ganz persönlich konfrontiert wären.;1
Stimmt die BRD geht mir auch am ARSCH vorbei. DEUTSCHLAND gillt es gegen POLITVERBRECHERwie MerkelSchulzu.MAAS zu schützen !!;0
Ich arbeite am Praterstern, und bin tagtäglich mit den Problemen konfrontiert, die sie nicht kennen. Das sind keine Vorurteile, das ist mein Alltag, und ich bezweifle das ein Journalist und eine Filmemacherin beurteilen können was Menschen ertragen müssen, die jeden Tag mit Situationen konfrontiert sind, die sich anders darstellen als ein Freizeitvergnügen am Fußballplatz.;1
Wie nennt man sowas noch mal?;1
Aber wir koennen sie nicht wollen, auch die Syrer nicht.;0
Bei Linksautonomen wäre das gar nicht so sicher... deshalb sag ich auch immer ganz bewusst... Extreme sind rechts gefährlich... aber links ebenso.;1
Es geht ja auch nicht nur um die Afghanen sondern um alle zusammen....Und warum haben die Minderjährigen und jungen Erwachsenen denn keine Chance mehr in ihr Land zurück zu kehren?Falls sie einen stichhaltigen Grund vorbringen können, werden sie auch Asyl erhalten. Falls es die gleichen Gründe wie in diesem Fall hier sind wohl eher nicht.Ist das so schwierig zu verstehen?;1
RAUS MIT DIESEN IRREN AUS DEM BUNDESTAG sollen ihre Konfettischwulenparaden woanders feiern am besten in Türkei bei Özdingens !;0
Die braucht kein neues Logo. |LBR| Neue vor allem vertrauenswürdige Politiker sind gefragt. |LBR| Kein #Drehhofer. Keine grenzenlose Einwanderung. |LBR| Schaut's euch in AUT um die machen es gerade vor wie es geht.;0
Die gesamte deutschfeindliche Asyl-Politik der Altparteien provoziert einen Bürgerkrieg! Die Grünen werden als erste vernichtet werden!;0
Der kann nicht anders schreiben - seit 24 h. Hab mir seinen Acc. angesehen der hat fast alle Follower aus D belegt. Bei den Amis zieht er den Schwanz ein - ach ja ist eine sie??;0
Da stimme ich vollkommen zu. Aber wo ist der Aufschrei gegen gegen integrationsunwillige Flüchtlinge oder gegen Linksextremismus ?Für mich ist VdB ist genaus links, wie Hofer rechts ist.Wieso soll linker Extremismus um soviel besser sein als rechter ?Soll nicht heissen, dass ich Hofer bevorziehen würde. Soll heissen, dass ich keinem von beiden Kandidaten vertraue, und es mir vorkommt, ich hätte die Wahl zwischen Pech und Schwefel.;0
Wir sind nicht mehr Papst wir sind jetzt Islam! Das ist das Geschenk von Merkel und Co.;0
Ich glaube, in erster Linie können die wahrscheinlichen Opfer glücklich sein, das sie nicht zum Ziel eines willkürlichen Mordversuchs geworden sind.;1
das fahrzeug ging bauartbedingt mit einer geschwindigkeit, bei der ein aufprall gegen ein festes objekt das überleben der fahrgäste nicht mehr sichergestellt ist.die einzige lösung kann also nur eine technische geschwindigkeitsbeschränkung sein, die autos prinzipiell nicht mehr schneller fahren lässt, als für die fahrgäste überlebbar ist.ich traus den amis zu, dass so ein urteil rauskommt...;1
Setz dir mal keinen falschen Lorbeerkranz auf die schmierige Frisur Mohammed!!: das tut die Deutsche Gesellschaft bestehend  aus Gutmenschen Duckmäusern und Hatern schon ganz von selbst... (orientierungslose Jugendliche in die Hände von Moslems treiben);0
So tief sind wir gesunken! Ein Merkel-Speichellecker mit dem IQ einer gewissen Fatima Roth eine Null (außer im Tonnengewicht) als Finanzminister!;0
...in 3 wochen vorbei......ohne journalisten in 2 wochen vorbei.....ohne verpflegung in 3 tagen vorbei...;1
Jeder der in der Right Trash liste von irgendso nehm linken Hurensohn ist ist ein Ehrenmann;0
Da sollte sie doch mal professionelle Texterhilfe in Anspruch nehmen und nicht selbst sowas Dümmliches verzapfen!;0
Eine nachweislich von einer Terroristen gesteuerten Grüne deutschfeindlichen Arschlochpartei von ca. 8% Irren hat in UNSERM Land nichts zu bestimmen!;0
Geld hat china sicher mehr das ist fix;1
...wie süß und entgegenkommend...das Auswärtige Amt nimmt Terminwünsche für den #Familiennachzug an. |LBR| Vielleicht holt man die Angehörigen auch einfach per shuttleservice direkt aus dem Herkunftsland ab. |LBR| Kannste Dir nicht ausdenken. |LBR| #N24;0
"Mit solchen """"Studien"""" können Sie sich die Wand pflastern, nur weil man etwas """"Studie"""" betitelt ist es noch lange nicht ernstzunehmen.";1
Es gibt so unendlich viele Vollspacken da hilft kein Arzt mehr! ????;0
"Ist doch auch irgendwie dämlich oder nicht? Oder denkt man da an die Sache mit der """"Ehre""""? Wird das noch so gehandhabt?";1
Ihr seit Saboteure am deutschen Volk!;0
... lol...mir scheint User 'alles mit scharf' ist auf einem Auge blind. da schiebt User 'realität_welcome' ein polemisches Troll Posting (wie man es sonst von der FPÖ kennt) aber der angefeindete Polemiker ist am Ende User 'Alpha Phoenicis' wegen seines kurzen Replys...Let´s not forget: Don´t feed the troll!;0
Was ist dir denn lieber ?? Burkha mit günem Punkt !! Oder ein verschwulter Braunhäutiger mit Federboa !! Herrgott hau die linken weg ! bitte;0
Da stellt sich aber dann die Frage, wieso von einem Hackerangriff posaunt wird wenn die Infrastruktur derart desolat ist.;1
Habt Ihr verstanden Ihr Hohlköpfe? Die 20 Politiker sind um Verbesserungen bemüht. |LBR| Wir brauchen keine aggressiven vermummten Feuerleger.;0
"Was machen diese bei uns mit Mut und Initiative? Welche Aussichten auf eine bessere Existenz haben sie? Eingliederung in ein Arbeitsleben ist aussichtslos. 16.000 Asylanten warten auf einen Arbeitsplatz! Für einen Schulbesuch müsste er erst Deutsch lernen. Bis er genügend kann, ist er für eine österreichische Schule zu alt.Er ist einer von vielen Kinderarbeitern, über die im Fernsehen berichtet wird. Diese Arbeit abzustellen liegt nicht in der Macht von Europa. Mit großem Bedauern muss man """"Kismet"""" zur Kenntnis nehmen. (DUDEN: dem Menschen von Gott zugeteiltes Los, dem er nicht entgehen kann.)";1
Auf allen Sendern wieder ein einseitiges und völlig verfälschtes Geschichtsbild (Bsp. ntv) &gti zum KOT*** ??;0
... auf der einen Seite gibt es kein Vermögen bzw. keine Handelsüberschüsse auf der anderen Seite.Das ist das Spiel, bei dem wir alle mitspielen. Memory mit aufgedeckten Karten ist gescheitert, sagen alle Experten.;1
ich liebe ihre Artikel und bewundere ihr engagment. sie tun so viel für die Sache, es ist wirklich ein Wahnsinn.;1
Flüchtlinge fliehen nach Deutschland parallel dazu lassen sie ihre Familien in der Heimat sterben sehr ehrenhaft....;0
haben Sie denn jemals mit einem dieser Jungs gesprochen? Ich schon und ich kann 100% sagen dass die meisten davon um einiges besser Englisch sprechen als gleichaltrige Österreicher. Nur weil sie aus deren Ländern geflohen sind heißt das nicht dass sie keine Ausblidung bekommen. Vonwegen Propaganda. Lächerlich!!!;1
Abschieben es sind doch nur Moslems!!;0
Strafmündig ab zwölf Nach israelischem Militärrecht, das in den seit bald 50 Jahren besetzten Gebieten für die palästinensische Bevölkerung gilt, beginnt die Strafmündigkeit im Alter von zwölf Jahren. Das ist laut dem Kinderhilfswerk Unicef in demokratischen Staaten einmalig. Ohhh das ist einmalig sagen die von der Kinderhilfwerk Unicef, wie niedlich dieser ausdruckweise.noch Schöner ist wie die meisten hier versuchen das ganz mit vergleichen schön zureden, dabei vergessen Sie das hier ein DEMOKRATISCHES Land so handelt und nicht die Diktatoren , also vergleichen die Lieben Israel Freundlichen Postler Israels taten mit Diktatoren und Sharia Staaten das ganze zeigt wie hier Doppelmoral das sagen hat.;1
Integration ist eine Frage der Mehrheiten und der Motivation. Vor 30 Jahren integrierte man sich noch Wer Deutschland liebt tut dies auch. Aber seit 20 Jahren schwebt den Parallelgesellschaften und den linksgrünen Deutschlandhassern eine andere Gesellschaft vor ...;0
Die Kosten von Glyphosat durch Steuern oder Umweltabgaben verzehnfachen und schon würde der Einsatz unrentabel. Da fehlt leider allein der politische Wille bzw die Lobbys sind zu mächtig.;1
Die gibt's jetzt schon, nur publiziert es noch niemand.;1
Mit maechtigen Unterstuetzern kann man so etwas machen.Im Westen unterstuetzt das Natobuendnis sowohl mit Waffen,Finanzen,politisch.Im Osten haben Saudis immer Terroristen unterstuetzt.Nato hat mit Einsatz von Terroristen experimentiert um ihre Ziele zu erreichen in Syrien,Lybien+Irak.Jetzt richtet sich der Terror gegen Europa.EU-NatoMinister haben dies jahrenlang in NatoKreisen besprochen,gebilligt+ausgefuehrt auch Westerwelle+Steinmeier.In Wirklichkeit haben sie mit Feuer gespielt.Die Nato hat mit Einsatz von Terroristen experimentiert um ihre Ziele zu erreichen in Syrien,Lybien+Irak.Jetzt richtet sich der Terror gegen Europa.EU-NatoMinister haben dies jahrenlang in NatoKreisen besprochen,gebilligt+ausgefuehrt auch Westerwelle+Steinmeier;1
"Nehme zur Kenntnis, sie meinen, Flüchtlinge sind so etwas wie Touristen die billig Urlaub machen wollen!?Ein Verschwörungstheoretiker sind sie auch noch, wie heißt es so schön """"..wer nichts weis, muss alles glauben..""""! Also lassen sie sich herab und versuchen sie mit Flüchtlingen zumindest zu reden, könnte ihren """"Horizont"""" erweitern, nur wenn sie """"Wert"""" darauf legen!Trotz alledem """"Liebe Grüße""""- so siehts aus!";1
"zumal die Asylverfahren hier ja teilweise unerträglich lange dauern""""Hm, eigentlich lag bis zum Vorjahr das vielgescholtene Ö bei der Dauer bis zu einem  Erstentscheid im absoluten Spitzenfeld Europas. Dass Einsprüche (und das sind über 80% bei Ablehnungen) und der weitere Instanzenzug länger bis sehr lang dauern liegt u.a. schlicht an den - auch von den NGO's gewünschten - Zuständigkeitänderungen und den mangelnden Ressourcen (Personal) dieser Stellen - aber auch an den Asylwerbern und ihren Lebensgeschichten.Wenn Sie wissen wollen was """"unerträglich lange dauern"""" bedeutet, sollten Sie eher in andere Staaten dieser Welt oder auch nur Europas sehen - Frankreich wäre da so ein schönes Beispiel.";1
Europäer begreifen langsam dass sie durch #EU allen voran #Merkel #Juncker nur belogen und betrogen und ausgenommen werden. |LBR| #katalonien;0
An diesem Abend ist der Stern ”Andrea Berg” untergegangen!!!;0
die sind empört - über die Koalition;1
"vor allem bei deutsch...das können die wenigsten einheimischen, nach 50 jahren """"perfekt""""nein, aber im ernst...verständigen nach acht monaten...ja klar...aber ich will sehn wie sie nur eine leichte sprache wie englisch in 8 monate auf """"perfekt"""" bringen...never ever...außer sie sind zufällig ein halber inselbegabter mit extremen sprachtaleneter ist zb so ein viech: https://de.wikipedia.org/wiki/Daniel_Tammetder zieht sich isländisch in einer woche rein...ich hab zb. fremdsprachlich kein besonderes talent und hadere heute noch mit den zeiten im englischen^^";1
Es ist kein Lager das Griechenland betreibt. Es ist ein illegales Camp, das von Freiwilligen versorgt wird.;1
Gadaffi stellte sein Zelt überall in Europa (Wien, Paris, London). Der Orientale wollte ganz einfach nicht ins Gemäuer, weil das nicht seiner Tradition entspricht.;1
Die einzigsten Fähigen Verbündeten Deutschlands wahren Finnland und Japan;0
"Nein, es ist die gleiche linke/anarchistische """"No Borders"""" Bewegung die auch schon im Votivpark extra eingereist kam um die Asylwerber dazu zu bringen nicht wegzugehen.";1
die Paris- oder Brüssel-Attentäter hatten recht, weil sie in diesem Falle die Stärkeren waren?Merkwürdige Einstellung.;1
Wie gehabt bei Illner Grüner + zwei Journalisten ein CDU u die Rot Grün versiffte Gesine Schwan ZDF versucht Grüne hochzupuschen |LBR| AFD wählen;0
Unsere Politiker sind zu blöd einen Terroristen auszuweisen weil er keinen Pass hat!!!;0
Was ich damit sagen will ist, dass das, was die Band ursprünglich ausmachte verfliegt und sich komischerweise immer dem anpasst, was momentan in den Charts ist.;0
Über Palästina hat Israel eine Militätdiktatur errichtet.Dort herrscht die Willkür der bewaffneten Soldaten.;1
Jetzt müssen Sie sich vorstellen, was sich die Helfer dort Vorort denken. Da fühlt man sich ja wohl mehr als veräppelt.;1
Soweit ich weiß, distanziert sich Nina Hagen inzwischen von diversen Aussagen, weil sie angeblich von ihrem Guru manipuliert wurde.;0
die Palästinenserführung Kinder zu Mördern ausbildet, ringt Ihnen nur ein müdes Lächeln ab, was?;1
Diese Armani-Punker leben auf der Sonnenseite des Lebens da kann man generös über die Probleme hinwegsehen??;0
Welches nette Bild von Linksradikalen hat denn da rausgesucht? Seid Ihr asozial!;0
"#Islamisierung ""Zusammenstöße zw GLÄUBIGEN (Richtig: #Islamisten) &ampi Sicherheitskräften"" - #Tagesschau sendet bereits im #Scharia-Modus";0
"Wenn ich ""Ralle"" höre oder sehe dann empfinde ich förmlich die Auswirkungen von ""Lochfraß"" im Hirn (BSE) ??";0
aber eben in Afghanistan und nicht in Österreich;1
"Merkel hat soviel Ahnung vom Auto wie die ""berühmte"" Kuh vom Sonntag!";0
Die Österreicher haben die Brandschatzungen und Überfälle der Muslime nicht |LBR| vergessen und sie damals davongejagt. Das gilt heute noch.;0
Ok,und was wäre Ihre Antwort...?;1
Im ernst?!;1
Sa Problem ist, dass ihm vermutlich noch niemand geagt hat, dass man dafür auch was tun muss und man sich in at nicht ALLES geschenkt kriegt.....aber über kurz oder lang werden wir am der med Uni vermutlich quotenplätze für Menschen mit fluchterfahrung haben, weil matura und aufnahmetest können Sie ja nicht schaffen und die nicht zuzulassen wenn sie sich wollen wäre gegen die Menschenrechte. Oder so.;1
Bei den Antifa Terroristen fällt mir nur eins ein „ Der Dieb rannte aus dem Kaufhaus und schrie haltet den Dieb“;0
Das ist erst die Vorhut. Die große Welle kommt erst.;0
"Unbegrenzte Zahlen"""" habe ich keine gesehen, und mit den bisherigen sind wir wirtschaftlich kaum überfordert. Das große Opfer, auf Polizeiturnsäle zu verzichten, kann man vorübergehend sicher erbringen. Im übrigen werden zB in Deutschand Schulturnsäle einfach zugewiesen, wenn es eng wird. Andere Länder tun schon auch was. Viele könnten mehr tun, aber das ist auch kein Grund für ÖSterreich, sich abzuputzen.";1
Das sind doch überwiegend junge Männer die uns überrennen wollen. |LBR| Die illegalen Invasoren brauchen Arbeit - in Arbeitslagern - fair.;0
Immer Hasskick wenn ich Merkel und Claudia Roth seh;0
MDR =Aktuelle Kamera. SED treu. Wir hätten die Mauer auf West Seite 10Meter höher bauen sollen.;0
Palästina war zwar bis zum Ende des WK  1 osmanisch beherrscht aber zu über 90 % arabisch bevölkert. Der Anteil der jüdischen Gemeinde lag 1918 bei 8 % und deren Grundbesitz bei 2,5 %. Danach veränderte sich das Verhältnis durch die zionistische Einwanderung bis 1948 auf 33% Juden mit 5,67 % Bodenbesitz. Die Siegermächte versprachen den Arabern für die Hilfe gegen die Osmanen Selbstbestimmung, gaben sie ihnen jedoch nicht und versprachen rechtswidrig den zionistischen Neokolonialisten ein Land, das ihnen nicht gehörte. Wenn Sie sich mit Fakten auseinandersetzen wollten, dann könnten sie nicht davon  reden, dass die Zionisten als Einwanderer ein Recht auf einen Staat  gehabt hätten.;1
"Da gibt es kein """"Problem"""" - es ist eindeutig eine Exekution.Wieso versuchen Sie das abzustreiten?";1
Die Tüten-Einräumer gibt es auch in den USA. Ansonsten natürlich Zustimmung.;1
Hab ihm geschrieben es geht mir am Arsch vorbei wenn man mich in D nicht mehr sieht.??????;0
Falls der Pali es überlebt hätte, hätte er es wieder versucht?;1
leider hat keine Band so schwer abgebaut wie Manowar seit der Triumph. Mittlerweile könntens schon zusammen mitn Gabalier auftreten :(;0
Wer erzählt ihnen den sowas?;1
Weil ihr nur darüber berichtet was Merkel euch erlaubt! Diese Aussage kommt aus euren eigen Reihen!!! Das gab es zu Hitlers Zeiten schonmal!;0
Merkel-Regime zufrieden: Kriminelle Organisation „Bundestag“ winkt Zensur-Gesetz durch |LBR| Von Anonymous - 30. Juni 20172126 20;0
absolutaber das ist nicht nur Sache der Lehrer, sondern auch Sache der Elternes sollte auch einmal wieder in Mode kommen, dass sich Eltern mit ihren Kindern in Sachen Wissensaneignung und den dazu benötigten Fertigkeiten befassen;1
naja eigentlich muß ich ja sagen,daß ich die band mochte und ich die platte ohne reinzuhören kaufte-das war leider ein fehler.die platte langweilte mich recht schnell.das die texte von unheilig schon immer pathetisch waren ist ja nicht wirklich neu.aber bei dieser platte nerven die texte.;0
Natürlich darf das debilste aller Effenargumente nicht fehlen. Schön zynisch verpackt damit auch wirklich jeder kapiert was für ein Rektalausgang sie sind.;1
so ein zufall - adel tawil, der gar nichts mehr mit rap zu tun hat und auch eigentlich nie hatte, ist hier bei staiger.de zu gast, jetzt wo diese neue ich+ich-scheisse rauskommt. aber letzten endes ist das eigentlich ein konsequenter schritt, auch wenn es ein weiterer rap.de-verrat ist - da wächst zusammen, was zusammengehört. geklaute popscheisse trifft auf abgehalfterte pseudo-rapszene. top, staiger, du bist der gorbatschow des raps in deutschland.;0
Tjaich denke EU wird an Bürgerkriegen zugrunde gehen ist ja genau das was die Eliten planen und der gierige LINKE Scheiß machts möglich !;0
"Wenn man sich selbst als Elite sieht (Burschenschafter-Denken), dann teilt man die """"Untermenschen"""" unter sich halt gern in Gut und Böse auf.Muss jeder selbst wissen, ob man jemanden wählen will - der offensichtlich keine Menschen mag.";0
Bald haben wir in Berlin Einen Imam als Bürgermeister.RRG haben abgewirtschaftet .Am besten wäre es wenn wir eine Mauer um Berlin ziehenum das Pack mitsamt der Meck-Pomm Schlampe zu isolieren aber bitte keine Care-Paketflieger schicken!;0
#CNN hat offenbar nur #Linksgestörte #Geisteskranke &ampi Leute mit schweren psychischen Defekten unter Vertrag ...;0
Alle Türken und Kurden aus Deutschland ausweisen ab in die Türkei!;0
Özoguz attackiert CDU AfD will Intergrationsministerium verhindern &gti RICHTIG etwa noch so ein Faulenzerposten für diese Chaoten??;0
wahrscheinlich läuft es auf schmiergeldzahlungen hinaus. was für ein armutszeugnis.da ändert Ihr neid auf die reichen auch nichts dran.;0
bitte link posten.;1
Ist mir scheissegal was der blöden Puppe angezogen wurde....Hauptsache Kent trägt eine Reichsuniform...!!;0
und schon gar nicht den aussagen von politikern;1
dort unten demaskieren sich immer mehr.;1
Warum einen Artikel lesen wenn man einfach so polemischen Dünnpfif dazu posten kann?;1
Waren sie schon dort? In Judäa und Galiläa gibt es keine Militärdiktatur. Von 4 Checkpoints sind drei von der Polizei von Hrn. Abbas. Es herrscht dort keine Willkür. Vergehen von israelischen Soldaten werden vor Gerichten verhandelt. Folter und andere Vergehen der Abbas-Polizei werden nicht verhandelt. Dafür hat Hr. Abbas keine Zeit...oder liegt es an der Ausbildung durch auch deutsche Polizisten?;1
...mein gleichlautendes post hat keine gnade vor dem zensor gefunden...;1
Wer ist dieser Almanuser überhaupt?;0
Edeka soll mal früher aufmachen die Hurensöhne;0
http://www.timesofisrael.com/suspect-in-tel-aviv-shooting-is-arab-israeli-from-wadi-ara/;1
Hallo waren es die Linksradikalen oder Reichsbürger die Anschläge auf Privateigentum verübt haben!!!?? die verkommene Lügenpresse war klar!;0
Warum so aggressiv? These heißt These.Ich bin selbst entsetzt über linksextreme Gewalt. Grün und links betreiben die Spaltung der Gesellschaft. Die Medien belehren die Leserschaft, die sozialen Medien werden in D zensiert.Anstatt direkte Demokratie nach Schweizer Vorbild zu implementieren, entfernen wir uns immer weiter von Demokratie.Ich bin alarmiert.;1
Flüchtlinge die kein Asyl erhalten haben gibt es nicht. Diese |LBR| Invasoren hätten an der Einreise gehindert werden müssen.;0
Trump ist tragische Figur. Er erkennt den Betrug am Volk. |LBR| Aber Establishment und Presse verhindern aus Eigeninteresse sein richtiges Handeln;0
müssen  muss er nicht, er hätte in einem anderen EU Land einen asylantrag stellen können, keiner kann mir erzählen, dass AUT das erste sichere land was, dass er auf seiner flucht betreten hat.;1
"the Occupying Power shall not deport or transfer parts of its own civilian population into the territory it occupies"""".https://www.icrc.org/ihl.nsf/WebART/380-600056""""The United Nations Security Council, the United Nations General Assembly, the International Committee of the Red Cross, the International Court of Justice and the High Contracting Parties to the Convention have all affirmed that the Fourth Geneva Convention does apply.""""https://en.m.wikipedia.org/wiki/International_law_and_Israeli_settlements";1
