Freundchen studiere die Weltgeschichte mal etwas genauer. In jenen Ländern  in denen Vollverschleierung (nur für Frauen) Pflicht ist  gab!!!! Es einst Kultur und #Vielfalt.  Vor!!!!! der #Islamisierung. |LBR| Bevor du jetzt meckerst geh bitte Frauen im Iran vor Steinigung retten!;0
Damit die bestätigung wie ernst es um die klimasituation steht.;1
Alien? Wie war es denn auf dem Heimatplaneten?;1
Abwerfen über Kabul.;1
"""Hoch legt an ... Feuer!""";0
weil man nicht als attraktives asylland dastehen will, geld und unterkünfte dafür gäbe es nicht nur in nö zuhauf;1
Weiß wer, ob man mit AppleTV problemlos die gängigsten Formate aus dem LAN abspielen kann? Per Fileshares am besten.;1
#Meuthen wie auch der Rest der #AfD toleriert doch längst den deutsch-nationalen #Antisemitismus #Rassismus &ampi die damit verbundene Hetze innerhalb der #LuegenAfD &ampi weiten Teilen #Deutschland‘s. #Maier ist wie #Gauland #Gedeon #Höcke oder #Poggenburg KEIN Einzelfall! #noAfD;0
Wenn die Leute ordentliche Schuhe kauften!Wäre sicher nett, mit Ihnen direkt zu diskutieren.;1
Soviel Zynismus in so wenigen Worten ist auch eine Kunst!;0
Leider verhält sich der Großteil der Opposition kontraproduktiv. Ein Teil verhält sich leider tatsächlich wie Nazis, der andere Teil versucht, mit markigen Sprüchen Kleingeld zu machen. Beides führt zu nichts, außer dass es Menschen verunsichert oder gar aufhetzt.;1
https://de.wikipedia.org/wiki/No_Border_NetzwerkEin linkes, anarchistisches Netzwerk. Bekanntlich haben aber extrem linke Gruppierungen ähnliche Verhaltensweisen wie rechte. (Gewalt, Hetze, Verbreitung von Falschinformationen);1
Ich denk auch, dass gelegentlich Westeuropa etwas zu hoch auf dem Ross sitzt... und den ehemaligen oder aktuellen Osteuropäern, Südosteuropäern nicht immer mit dem nötigen Respekt begegnet.;1
Vielleicht sollte mal jemand der Deutschland Hassenden Partei B 90 die Grünen erklären was Subsidaerer Schutz bedeutet. Ich führe doch keine Menschen zusammen die dieses Land absehbar wieder verlassen müssen. Wer soll diesen Irrsinn den bezahlen? Die Grünen etwa.;0
Europa führt keine Kriege mehr untereinander aber die Staaten gehen einzeln zugrunde wegen der #EU Flüchtlings Politik. |LBR| Europa zerstört sich;0
Dagegen kann aber wahrscheinlich nur Griechenland vorgehen.;1
"Ist doch kein ""schlimmer Rassismus"" wenn er gegen Schonlängerhierlebende geht. Schliesslich muß man jede Chance nutzen den Deutschen kleinzuhalten- "" nach DER Vergangenheit...""";0
"Was? Unsinn! Der Linguistik turn beschränkt sich auf Metaphysische """"Realitäten""""... so wie die """"realität des wortes rot"""". Und aus sicht von Philosophen die den mit gemacht haben macht der Satz  """"...dass nicht mehr die realen Tatsachen zu realen Einstellungen führen, nein, die falschen Wörter führen zu den falschen Einstellungen"""" gar keinen Sinn. Was sie meinen ist ein metaphysische Position... nämlich die der Antirealisten oder Konstruktivsten... aber auch nur in der Bla-bla-form der Politisierung von Leuten die Genderstudies machen.";1
"Lese gerade bei Akif das die komische ""Ich auch""-Debatte noch läuft !! Meine Lebensgefährtin sagte das es auffallend sei das die Frauen die jetzt die Klappe aufreißen erst ab einem bestimmten Karrieregrad nun meinen das sie die Scheere nicht aufmachen wollten! Soviel dazu!";0
Die armen Beamtinnen!;1
Es ist sozusagen ein öffentliches 'Geheimnis': Immer schon da, aber keiner guckt hin. Die Natur!Ich lebe das seit 20 Jahren höchst erfolgreich, hab daraus meine Diplomarbeit gemacht (Evolutions- basierte Salutogenese), gebe das in Vorträgen und Büchern weiter und verschenk's auf 'paradise your life';1
Der Ablauf in der von Merkels Vasallen geführten Sendung wurde vonnMerkel vorgegeben und die Fragen auch! Wessen Brot ich esse dessen Lied.;0
Abgesehen davon, dass es genügend Limousinenanbieter gibt, die eigene Flughafengebühren haben (17. Bezirk z.B. €28 bzw. €35 mit 5erBMW) - ja sind selbst €50 kein Grund die Zeit von Freunden unnötig zu strapazieren (außer von mir aus, wenn er/sie arbeitslos ist und eh nicht weiß was man den ganzen langen Tag machen kann). Aber vom 17. zum Flughafen würde ich mit einem minimum Zeitaufwand von 35min in eine Richtung schätzen, dh 70min dafür, dass jemand ein paar Euros spart ... mM nach Frech.;0
Die STAATSMEDIEN sprechen sich noch nicht mal ab !!! Einer hat gesagt  das der Staat Fehler gemacht hat und auf Folgen von MOSLEMTERROR nicht vorbereitet war! Aber wer hats gesagt??? Erst heißt er dieMIESEEHRE und dann wieder MAASmänneken !!LÜGELÜGELÜGE von STAATSMEDIEN!!;0
Wie lautet eigentlich das Hashtag? #DateGate? :-D;1
Nix abgeschoben....13jahre sind zwar zu wenig aber für die Gitterstäbe bezahlen wir gerne. |LBR| Danach die Ratte entsorgten..!!;0
na dann nocheinmal:Fahren nach Braunau aus andere Länder auch? Neona.zis haben (leider) überall, aber mandann davon nicht lesen....;1
"Und weil das Motto """"Ohne Grenzen"""" heißt wird dem Gegner im ersten Bild gleich mal munter ein Kopfstoß ala Zidane verpasst?  (C',";1
Auf Seite 31 in obigen Dokument finden Sie die Zahlen, die meine Aussage untermauern.Lieber Meerwelle, ich schätze Ihre Beiträge, aber beim nächsten Mal fragen Sie doch einfach nach den entsprechenden Seiten im Dokument, bevor Sie mir eine Lüge unterstellen!;1
Die Linken. SED KED Sozialilstich Kommunistische Einheits Partei Deutschlald. Sozial Demokraten Arsch lecker von Hittler. CDU gegründet aus Stasi und Gestapo Mitglieder. Willkommen im 4ten Reich.;0
Was fehlt sind nicht Lehrlinge, sondern geeignete Lehrlinge. Nicht solche, die die Sprache nicht sprechen und bei denen schon die Grundrechnungsarten nicht sitzen.;1
Praktisch haben einige europäische Dummköpfe beschlossen einigen Verbrecherkollegen in Afrika mehr Geld zu schenken!;0
und du bist die Obertunte.;0
Alle islamischen Kindergärten schließen. Wir brauchen keine |LBR| Parallelgesellschaften. Dort wird der Bezug zu Österreich unterbunden.;0
Das schlimme ist gerade hier in Dortmund das solche Situationen häufig und alltäglich sind ! Siehe auch Berliner Polizei ! Gibt ja jede Menge Beispiele LinksGrün-zersetzter Truppen! Es ist einfach nur noch zum kotzen!;0
Widerlich dieser Schmidt. Ohne Rücksicht auf die Bienen. Dieses |LBR| Stück Gewissenlosigkeit muss abgewählt und davongejagt werden.;0
Japp so sind sie die guten Wahrheitsliebenden Denunzianten-Ex-Mauermörder der SED und STASI die sich in UNSEREM System eingefressen haben !Wenn Leute wie Kahane an Schlüßelpos. gesetzt wurden dann muß das zwingend geändert werdden !;0
Es geht primär um Wissen, Bildung;1
Piefke!Zuerst gscheit österreichisch lernen, dann stenkern!;0
Von den 300.000 legalen Kopien wurden 46% in DE gekauft.(=138.000)Von den 1.600.000 illegalen Kopien wurden ca. 4% in DE genutzt.(=64.000)Macht zusammen 202.000 Kopien in DE.Und 64.000 von 202.000 sind 31,7%;1
Ja, das würde ihn sehr freuen. Dann muss er nicht ins Gefängnis.Herr, lass Hirn regnen.;1
Gründlich daneben.;1
Sollten nicht #Ärzte und #Facharbeiter kommen? Gekommen sind #Mörder und #Vergewaltiger. Ist das eure Bereicherung ihr #Gutmenschen?;0
"das steht unserem Profit doch sehr im Wege, so geht's """"der Wirtschaft"""" (dem Kapital) nicht gut.Also billig und flexibel arbeiten bis 68, nicht blöd auf Urlaub fahren sondern Eigenvorsoge ansparen, deswegen braucht's eh keine 6. Urlaubswoche.Und falls ihr schon alt und über 40 seid, so lassen wir sogar  euch als geförderte Ausfstocker trotzdem an unsere Maschinen. Weil für unseren Profit seid ihr uns nicht zu schade - aber halt immer zu teuer.Wir sind die Guten";0
Glauben Sie denn nicht, dass die Polizei gerufen wird, wenn wo jemand gesehen wird? Noch dazu, wenn man als Anrainer uU jetzt schon seit Wochen Aktivisten und die Deppen unter den Migranten sich gebärden gesehen hat?Flüchtlingsjäger mit Panzer gibt's am Balkan ja auch.;1
...ist Afghanistans größtes Hindernis.Laut der US-amerikanischen Behörde liegt die Fertilitätsrate in Afghanistan mittlerweile bei durchschnittlich 5,7 Kindern je Frau. Der Rückgang hat erst kürzlich eingesetzt. Das U.S. Census Bureau geht davon aus, dass die Bevölkerung von Afghanistan von 28,4 Millionen (Mitte 2009) bis 2050 auf 53,4 Millionen wächst, sich also beinahe verdoppelt. Die Vereinten Nationen sprechen sogar von 73,9 Millionen im Jahr 2050.;1
Neidisch?;1
Eine dumme Labertasche dieser ...;0
"#btw17 #MSM- &ampi #Polit-Kriminelle befeuern derweil d Hass auf d #AFD mit #Hatespeech wie ""Die demokratischen Parteien müssen zusammenstehen""";0
Facebook ist nur für Posten von Urlaubsbilder geeignet...und den Migranten-Dreck will man uns mit aller Gewalt schönreden..zum kotzen..!!;0
Hast du auch Belege das diese deine hetzerische Aussage auch Nachvollzogen werden kann?;1
Vielleicht gibt es ja beim Standard eien Live-Ticker, nachdem der ORF scheinbar das Spiel Nadal vs. Thiem nicht überträgt, wär doch was, oder? Wer stimmt mir zu - grünWer ist dagegen - rot;1
solche racheakte gibt es auch jeden tag, nur werden sie nicht jeden tag gefilmt.;1
Für den Fall, dass die Fragen ernst gemeint waren: jugendliche Flüchtlinge können natürlich in Österreich in die Schule gehen. Es gibt Lernzentren, die darauf spezialisiert sind, dass Leute einen Pflichtschulabschluss nachholen können, und um da hineinzukommen, müssen Asylwerber nur jünger als 25 sein. Danach können sie z.B. eine Lehre oder eine andere Ausbildung machen, und werden hier dann Facharbeiter. Natürlich wäre es für das alles einmal notwendig aus Traiskirchen herauszukommen, und in eine vernünftige Betreuungseinrichtung für unbegleitete minderjährige Flüchtlinge zu kommen, von denen es gerade zu wenige gibt. Deshalb wäre es so notwendig, mehr Flüchtlingsquartiere in der Grundversorgung insbesondere für Jugendliche zu schaffen!;1
Wenn man genügend bezahle pietätlose Antifa Idioten findet;0
"Wer schaut wen als """"Bürger zweiter Klasse"""" an?Wenn man über den Islam liest, wo die PA-Leute hin gehören, haben sie Juden und Christen IMMER als """"Bürger zweiter Klasse"""" missbraucht. Die Israeli missbrauchen die PA-Leute NICHT als """"Bürger zweiter Klasse""""!Sie haben nur schlechte Erfahrungen mit ihnen gemacht. Darum haben die Israeli asiatische Leute geholt, die arbeiten können. Die PA-Leute spielen sich sowieso nur auf, sind unzufrieden und streiken bei jedem Hahnenschrei.";1
Bei einigen Promis zeigt sich das sie entweder zu viele Schnaps Pralinen gefuttert haben oder was wahrscheinlicher ist eine Gehirn Prothese tragen.;0
Grüne und Linke beim ertrinken sollen sie absaufen....nur die kriegt ein Rettungsring...?? |LBR| Eines ist Fakt......lieber AfD als Linke..!!;0
"Wisst Ihr noch mit IM ""Erika"" wird es keine Maut geben ?????? wir schaffen das ?????? jo das Chaos der Blitzbirnen hat sie geschafft ??";0
Gott sind Sie bescheuert darf ich Sie an meinen Follower Herrn Dr.Alessandro Meluzzi weitergeben er ist Psychater und Kriminalist und schreibt zum Thema Ur-Logen und kann Ihnen auch den NSU Tatort analysieren.;0
"Ich wünsche mir für sie dass eine Großfamilie aus ""Syrien""  einzieht. Leider wäre solch eine kleine  schlecht ausgestattete Wohnung für die neuen Herrenmenschen keine artgerechte Haltung....";0
Beuteland Germonney.  Der Koran preist es in schmachtvollen Hymnen...;0
Schöner scheiss, gute besserung *daumendrück*;1
Für den zensierten Scheiss auch noch mehr bezahlen? So eine Unverschämtheit.Freie Senderwahl ich bezahl nur die Sender die ich sehen will.;0
Wie dämlich müssen erst die Sesselfurzer sein wenn sie den Unterschied von 17 und 32 Jahren nicht erkennen....?;0
Was nun?Was soll die AfD an die Wand fahren und schlechter machen als diese AntiDEUTSCHEN wie 365TageSCHULZ und SED-MERKEL?VERSUCHmachtKLUG;0
Die Linken Gender- und meetooidioten die du in den Staaten kennst  natürlich nicht.;0
Das es ein paar Monate dauert, bis ein Asylantrag abgelehnt wird (oder Asyl gewährt wird), lassen sie mal einfach außer acht. Mann, denken sie doch nur ein bisserl, bevor sie so etwas posten.;0
Ich würde Grüne mit einem Geschwür am Arsch der Welt bezeichnen. Ist aber meine persönliche Meinung. Ein Geschwür kann einen Körper zerstören oder ein ganzes Land.;0
Wie gesagt. Dumme Kinder von alt 68er die man besser abgetrieben oder besser ins Klo gewichst hätte. Und ich bin kein AFD Wähler.;0
Ein Recht was es nicht gibt, kann man nicht ausdehnen;1
Die Frage die sich in Wahrheit stellt ist. Ist der Islam wirklich eine Religion. Oder eine Rassistische Ideologie.;0
"Ich warte nur noch drauf dass die Grünen ihre V-Waffe ""Claudia"" zum Einsatz bringen und der Bayer ohne Eier Frauenbeauftragter wird ??????";0
... in der Originalaussendung, also nicht die der APA, steht verhaftet (arrested) ...;1
Wie blöd sind deutsche Politiker eigentlich???;0
So einen wie den haben wir früher in der Pfeife geraucht. Heute auch noch;0
Ich mag es nicht, aber ich mag Cassandra nicht.;0
"denken Sie wirklich """"der Gedanke ist mir nicht gekommen?"""" Schon mal so jemandem erklärt, dass es aus ist ? Sie haben keine Vorstellung was es mich an Kraft, Gesundheit und Lebensfreude gekostet hat diese Trennung durchzuführen.Ich wurde gestalked, erpresst, verleumdet, geschlagen, systematisch terrorisiert, sogar meine Elterm etc etc.. Hätte ich ich diesem absolut grotesken Horror nicht selbst miterlebt, würde ich wohl das selbe sagen wie sie..weil es ja auch richtig ist.Aber sie haben keine Ahnung, nicht mal ansatzweise...";1
"na dass die """"Flüchtlinge"""" ihre versprochenen Häuser, Autos und den >100k Job bekommen. Nur noch der Zaun hält sie davon ab.";1
Und N24 geht mir auch aufs Arschloch heute morgen // Über Trump--er klage das Medien unehrlich sind!!?!?soll er mal nach????kommen !!!!;0
"Ich habe zwei mal Angesetzt um Ihre Frage zu beantworten, es ist aber schwierig. Denn es gibt für mich nicht """"den"""" israelischen Soldat und auch nicht """"den"""" Terroristen.Fakt ist das in diesem Konflikt viele Emotionen enthalten sind. Ich habe auch darüber nachgedacht und bin zu dem Entschluss gekommen, dass ich nicht die Gabe besitze in diesem Konflikt unvoreingenommen und unparteiisch zu urteilen. Darum wünsche ich es mir ebenso wie 1.Kp / EW 74, hoffentlich nie so eine Frage beantworten zu müssen.";1
Dieses zynische Unwissen ist einfach nur erbärmlich. Ich sehe sie direkt vor mir wie sie mit ihrem Schmerbauch vorm PC sitzen und einem afghanischen Jungen erklären wollen welch tolle Möglichkeiten er doch in Afghanistan hätte und er sich doch schnellstens zurückschleichen möge.;1
Schau…die offiziellen Bildungsdaten der betreffenden Länder sind auch für in Recherche Mittelbegabte leicht zu finden. Dass uns in derlei Artikeln immer nur Vertreter einer statistisch absoluten Minderheit präsentiert werden, muss ja einen Grund haben. Da ich nicht an einen über Monate andauernden Zufall glaube, wird wohl eine bestimmte Agenda dahinterstecken. Die ich übrigens für absolut kontraproduktiv halte...;1
Sex haben sie weil sie geil sind.Verhüten tun sie nicht weil es zu umständlich ist und eh nix passieren wird wei man hat zB grad die Regel gehabt oder wassauchimma.Und falls doch, dann gibt es noch diese letzte Möglichkeit um ganz sicher kein Kind zu kriegen.;0
ja, lt. http://kurier.at/chronik/oesterreich/vermisstes-13-jaehriges-maedchen-in-tirol-wieder-aufgetaucht/191.084.872 kam sie unversehrt zurück! Gott sei Dank. Aber ich frage mich wer ihr so die Fresse poliert hat.;1
Dortmund haut wieder auf die Kacke ! Die wollen die ganzen Braunhäutigen verjagen mit dem Slogan BUNT STATT BRAUN !! BRAVO !!!;0
"Der ""Pirat"" muss den Champagner nicht öffnen. Mit einer vollen |LBR| Flasche kann er sich seine üblen Wünsche besser aus dem |LBR| Kopf schlagen.";0
Der hat und brauchte nicht solche Lügen und Märchen den Bürgern zu verklickern wie Sie Herr Seibert! Aber es gibt eben Leute die für Geld ALLES labern!;0
Schickt unsere Verdeidigungsministerin als Stangengirl zur Truppenbetreuung an die Front aber selbst dort wird sie Versagen.Eine Verteidigungsministerin ist Ein Hohn an die Truppe.Rommel wache auf!;0
"gut so nicht nachlassen wir posten alles was wir gegen Merkel finden bin zum 24 September!! |LBR| Ziel muss sein ""Merkel ist weg!""";0
Eine die Ihren Hals aus der Schlinge ziehen will in dem sie Bürgerkrieg in Europa anzettelt und einen Kontinent dem Islam opfert;0
Ich würde eher fragen: Hat irgendjemand jemals die Gültigkeit des Oslo-Abkommens in Frage gestellt? Das wäre nämlich wohl eher der springende Punkt. Dir ist klar, dass die pal. Aurtonomie hinfällig ist, wenn du recht haben solltest?Ich denke, dass die Frage mit der Schaffung der pal. Autonomie beantwortet ist. Wäre ja noch schöner, wenn man sich die Rosinen rauspicken könnte. Die eine Seite erfüllt die Fordeerungen des Abkommens (und das hat Israel), während die andere nichtmal ratifiziert und deswegen nicht dran gebunden sein soll. Nebenbei gibt es keine Rechtfertigung für die pal. Weigerung, das Abkommen zu ratifizieren. Israel brauchte nach der Unterzeichnung genau eine Woche für die Ratifizierung.;1
Der größte Finanzbetrüger aller Zeiten trifft einen Grünen deutschfeindlichen Türken! Diese Dummlaberei sollte sich niemand antun!;0
Werden wir und müssen wir NICHT! Es sind zu 99% nur Sozialtouristen (auf gut Deutsch: Schmarotzer) und zigtausende Kriminelle/Terroristen darunter! Das ist bewiesen!;0
"Sie vergessen die Balkanländer. Auch von dort """"flüchten"""" Menschen und wollen hier versorgt werden.";1
Die Grünen die aus einem kriegsfreien Land Syrien noch mehr Sozial-Touristen (und evtl. tausende Terroristen und sonstige Kriminelle) holen wollen ist ein extreme deutschfeindliche 89%-Partei! Wird Zeit diese Idioten zu verb;0
ja eh? die müssen ja nicht dafür bezahlen!? Oder wo wird bei den österreichischen Familien gekürzt, sodass sie nicht mehr über die Runden kommen wegen den Flüchtlingen? Das würde mich jetzt echt interessieren!;0
Betroffenheit ist keine Lösung. Also Lösungsvorschlag bringen.;1
Im Grunde hätte Dir Bosbach eine schallende Ohrfeige |LBR| geben müssen dass Dir der Fächer davongeflogen wäre.;0
Trump wagte es den ersten Schritt zu machen...die hochdotierten Unwissenden stopfen sich nur die Taschen voll.. |LBR| Klima raus aus der Politik.;0
Wieso kann die Frau einen Schlägermann nicht verlassen? Ist die Tür versperrt?Die Gründe sind doch ganz andere, zB gemeinsame Kinder, die man nicht im Stich lassen kann.;1
seit wann: christlicher Fußball sieht wie aus? Bei Foul hält der Christ auch das andere Bein hin... oder doch Aug um Auge, Bein um Bein... sonderbar dass manche oft den Fokus dorthin legen, wovon eigentlich gar nicht die Rede ist...oder biblisch: Was siehest du aber den Splitter in deines Bruders Auge und wirst nicht gewahr des Balkens in deinem Auge? (Matthäus 7:3);1
Wie wäre es denn, wenn man nicht nur verdiente Bürgermeister ins Parlament schickt, oder Vertreterinnen der Jugend- oder Pensionistenorganisationen, sondern Fachleute. Die dann in einem Dialog mit anderen Fachleuten, aus den Ministerien, aus den Interessenvertetungen, Ideen entwicklen. Und letztlich die Gestaltung von neuen Regelungen entscheiden.Das wäre doch mal ganz was neues im Vergleich mit der aktuellen Abnick-Bude, die nur die von den Ministerien vorgelegten vorab mit den Sozialpartnern konsensual abgestimmten Entwürfe formell genehmigt..;1
wann lernt dieses Teil endlich mal singen !!!;0
mit anderen worten, du bist für zugangsbeschränkungen ',);1
Unternehmensgründung - wie ein richtiger konkurs so funktioniert hat man jetzt als ex angestellter ja mitbekommen, die paar hunderttausend euro schulden zahlt ma halt dann aus der portokasse - haushaltskassaQualifizierung - hätt ma vielleicht schon früher für die angestellten parat haben könnenein echter arbeiter vertreter;0
ab in die säureminen mit ihnen!;0
sagt er eh dauernd;1
Das beste Mittel gegen die angebliche Hetze sind Argumente dagegen. Das sehe ich aber Ihnen nicht. Sie stricheln selbst alle Postings rot die eine andere Meinung ausdrücken und das war es schon wieder. Also beginnen Sie über den Inhalt jedes Postings nachzudenken und dann antworten Sie darauf mit Argumenten ohne dabei gegen das ganze Forum zu hetzen.;1
"Seit drei Monaten besucht er fünfmal in der Woche Deutschkurse – und das merkt man auch. In nahezu perfektem Deutsch erzählt er davon""""=> jo genau, bissl Einidrarer seids schon";1
Sie gab es nur zu wegen des Deals. Ich komme aus Israel. Raten Sie mal, in welcher Sprache die Prozesse geführt und Geständnise zur Unterschrift vorgelegt werden.Das gefundene Messer ist ein Vorwand. Ich bin mir absolut sicher, dass ein körperlich nicht überlegenes 12-Jähriges Mädchen ein Messer als Mordwaffe auswählen würde, um einenSiedler anzugreifen.;1
http://www.skrapid.at/de/startseite/news/news/aktuelles/2016/02/stellungnahme-des-sk-rapid-wien/;1
ihr lehrender hat ihnen auch eingeredet, dass sie selbst daran schuld tragen. genau so läufts in unseren bildungseinrichtungen. NIEMALS kann der lehrende schuld tragen.;1
nö - seit 2005 hat sarah auch keine erfolge mehr :D;0
subventionierte Milchbauern, die viel zu viele Kühe haben;1
Was für eine missratenes Blechgesicht....;0
Da Asylanträge aus MNE in A unterhalb der Statistik liegen, kein relevantes Thema.;1
warum geht Israel nicht abschließend gegen die Silvesterraketen-idioten vor, sondern vergewaltigt die friedlichen Palästinenser im WJL, durch Zäune, Mauern, Siedlungen, nächtliche Razzien allg. Staatsterror?Haben Sie dafür auch eine Antwort?Ist das die isr. Reaktion auf den pal. Friedenswillen im WJL?Wann kam denn von dort der letzte Raketenangriff?;1
"Haben Sie das Wörtchen """"nachweisbar"""" in meinem Posting gelesen?";1
Zuerst das Zelt und darunter  Narzissen Hotel.Eh wurscht?;1
ah - klar.;1
Nein, natürlich gibt es nicht eine einzig richtige Lebensweise.ABER wenn man in einem fremden Land aufgenommen wird, muss man nicht meinen dessen Bevölkerung von der eigenen Lebensweise und den eigenen Werten überzeugen zu müssen. Genau das passiert doch gerade.Auf Afrika geh ich nicht näher ein. Da müsste man zu weit ausholen. Ich hoffe nur die Millionen, welche an der Küste warten bleiben uns erspart, so hart es klingt.Und klar beruht unser Wohlstand auf der Armut der anderen, das hat jedoch jeder selbst in der Hand. Solange man in einen Kik oder Primarkt rennt wird sich das auch nicht ändern.Ein wenig Eigenverantwortung und Bewusstsein sollte dann schon sein.;0
spannend, was Robert F. Kennedy jun. kürzlichst im Politico zur amerikanischen Nahost-Politik sagt....;1
Meckert herum? Sie wird ja schon fast dazu gedrängt, irgendwas negatives über Kurz zu sagen, obwohl das nicht ihr Ressort betrifft.;1
oder zum shoppen einiger neuer fehlkäufe?- es ist mir irgednwie gerade entfallen. wir haben so viele belastungen wo es sich zu kämpfen lohnen würde, aber die (politische) energie geht in die bekämpfung einer nebensächlichen. weils einfach ist, verstehe ich schon. ändert aber an den fakten nix.;1
ich glaube zwar, dass merkel diese einladung nicht so direkt und bewusst ausgesprochen hat, wie man ihr jetzt unter zu jubeln versucht...aber es wäre definitiv hilfreich, wenn sie öffentlichkeitswirksam bekannt gegen würde, dass deutschland voll wäre..... neuankömmlinge kein geld mehr bekommen....etc.;1
Die Schulden der Griechen soll der deutsche Steuerzahler übernehmen |LBR| denkt Martin Schulz. Jagt ihn davon den schulischen Versager.;0
Schulz das REKTUM ist wirklich nicht mehr zu ertragen unser 365 Tage AMTMANN ! Ich lass mir den nicht gefallen auf keinen Fall !;0
"Eine undankbare Farbe!""""";1
arrestiert;1
"Wie man an dem Wahlergebnis gesehen hat sind die ""Deutschen Trottel"" noch immer in der Mehrzahl!";0
Vorsicht! Anette Humpe und ihr Mitstreiter haben wieder ihre Instrumente ausgepackt und bewerfen uns mit musikalischen und textlichen Klischees.;0
"Witzig...Hr. Abbas beruft sich aber auf das Abkommen. Es dürfte vielleicht also doch seinen Weg """"ins Leben"""" gefunden haben. Vor allem die Vehemenz, mit der sich dieser Herr auf bei Steuereinnahmen auf dieses Abkommen beruft.Welche Siedlung meinen denn sie genau? Die auf jüdischem Land? Die auf ehemaligen jordanischem Land oder die Ländereien, die arabisches Privateigentum sind. Bei letzterem bekommt jeder Araber vor einem israelischen Gericht recht. Wie sieht es mit rein arabischen Siedlungen aus? Sind die auch rechtswidrig?Vielleicht sollten sie einmal die Geschichte von Hebron genauer betrachten. Sie haben dort ca. 3000 Jahre jüdische Siedlungsgeschichte, Progrome und Vertreibung der Juden.";1
Das entsprechende Regelwerk gibts: entweder wartet man, bis er volljärhrig ist oder man braucht ein Familienmitglied bzw. eine Einrichtung, in deren Obhut man ihn übergeben kann, muss alles vorher abgeklärt werden.Da wird man sich was überlegen müssen, die Zahl der UMFs steigt rasant an, nicht nur aber auch aufgrund der bulgarischen Passfälscher. Und damit sind wir schon beim Thema, ich möchte im Standard inmitten all dieser Betroffenheitsgeschichten ja nur einmal einen kritischen Artikel lesen, bezüglich Schleppern, bezüglich all den anderen Kriminellen, die sich bereichern (auf die Kosten der aufnehmenden Länder), über besonders dreiste Asylwerber, die gibts nämlich auch, oder über langzeitarbeitslose Eritreer in der Schweiz.;1
Der Geist stimmt einfach nicht. In den Kirchen herrscht linksgrüner Humanismus. Der hat sich einst dem Nationalsozialismus und nun dem Islam unterworfen. |LBR| Der heilige Geist gibt Kraft zu widerstehen. #Bonhoeffer;0
Keine Kurde kann IS und Türken Barbarei verteidigen.;0
Oh mann sorry ich vergass.Das Recht auf Unversehrtheit gilt nur für Neubürger....??;0
In den Augen von „Fortschrittlichen” schon …;1
Ne das gibts nicht ist der Vollpfosten immer noch da???;0
